-- Test gprecoverseg from config file uses the correct dbid.
--
-- In github issue 9837 dbid in gp_segment_configuration is not
-- consistent with dbid in file internal.auto.conf.
-- This is caused by gprecoverseg fetch the smallest dbid in
-- gp_segment_configuration which is not occupied by others when
-- adding a new mirror. When dbid in gp_segment_configuration is not
-- continous, the inconsistent issue will happen

--
-- generate_recover_config_file:
--   Generate config file used by recoverseg -i, to trigger '__callSegmentAddMirror',
--   we should recover the segment to a different datadir location instead of its
--   original one.
--
create or replace function generate_recover_config_file(datadir text, port text) returns void as $$ import io import os myhost = os.uname()[1] srcConfig = myhost + '|' + port + '|' + datadir dstConfig = myhost + '|' + port + '|' + datadir + 'temp' configStr = srcConfig + ' ' + dstConfig  f = open("/tmp/recover_config_file1", "w") f.write(configStr) f.close() 
configStr = dstConfig + ' ' + srcConfig f = open("/tmp/recover_config_file2", "w") f.write(configStr) f.close() $$ language plpython3u;
CREATE

SELECT dbid, role, preferred_role, content, mode, status FROM gp_segment_configuration order by dbid;
 dbid | role | preferred_role | content | mode | status 
------+------+----------------+---------+------+--------
 1    | p    | p              | -1      | n    | u      
 2    | p    | p              | 0       | s    | u      
 3    | p    | p              | 1       | s    | u      
 4    | p    | p              | 2       | s    | u      
 5    | m    | m              | 0       | s    | u      
 6    | m    | m              | 1       | s    | u      
 7    | m    | m              | 2       | s    | u      
 8    | m    | m              | -1      | s    | u      
(8 rows)
-- stop a primary in order to trigger a mirror promotion
select pg_ctl((select datadir from gp_segment_configuration c where c.role='p' and c.content=1), 'stop');
 pg_ctl 
--------
 OK     
(1 row)

-- trigger failover
select gp_request_fts_probe_scan();
 gp_request_fts_probe_scan 
---------------------------
 t                         
(1 row)

-- wait for content 1 (earlier mirror, now primary) to finish the promotion
select wait_until_segment_accepts_connections(1);
 wait_until_segment_accepts_connections 
----------------------------------------
 OK                                     
(1 row)
1U: select 1;
 ?column? 
----------
 1        
(1 row)
-- Quit this utility mode session, as need to start fresh one below
1Uq: ... <quitting>

-- make the dbid in gp_segment_configuration not continuous
-- dbid=2 corresponds to content 0 and role p, change it to dbid=9
set allow_system_table_mods to true;
SET
update gp_segment_configuration set dbid=9 where content=0 and role='p';
UPDATE 1

-- trigger failover
select gp_request_fts_probe_scan();
 gp_request_fts_probe_scan 
---------------------------
 t                         
(1 row)

-- wait for content 0 (earlier mirror, now primary) to finish the promotion
select wait_until_segment_accepts_connections(0);
 wait_until_segment_accepts_connections 
----------------------------------------
 OK                                     
(1 row)
0U: select 1;
 ?column? 
----------
 1        
(1 row)
-- Quit this utility mode session, as need to start fresh one below
0Uq: ... <quitting>

-- generate recover config file
select generate_recover_config_file( (select datadir from gp_segment_configuration c where c.role='m' and c.content=1), (select port from gp_segment_configuration c where c.role='m' and c.content=1)::text);
 generate_recover_config_file 
------------------------------
                              
(1 row)

-- recover from config file, only seg with content=1 will be recovered
!\retcode gprecoverseg -a -i /tmp/recover_config_file1;
-- start_ignore
20260621:22:45:36:2274477 gprecoverseg:b40467422d7d:gpadmin-[INFO]:-Starting gprecoverseg with args: -a -i /tmp/recover_config_file1
20260621:22:45:36:2274477 gprecoverseg:b40467422d7d:gpadmin-[INFO]:-local Greenplum Version: 'postgres (Greenplum Database) 8.0.0-alpha.0 build dev'
20260621:22:45:36:2274477 gprecoverseg:b40467422d7d:gpadmin-[INFO]:-coordinator Greenplum Version: 'PostgreSQL 15beta2 (Greenplum Database 8.0.0-alpha.0 build dev) on x86_64-pc-linux-gnu, compiled by gcc (Ubuntu 11.4.0-1ubuntu1~22.04.3) 11.4.0, 64-bit compiled on Jun 20 2026 18:57:35 (with assert checking)'
20260621:22:45:36:2274477 gprecoverseg:b40467422d7d:gpadmin-[INFO]:-Obtaining Segment details from coordinator...
20260621:22:45:36:2274477 gprecoverseg:b40467422d7d:gpadmin-[INFO]:-Heap checksum setting is consistent between coordinator and the segments that are candidates for recoverseg
20260621:22:45:36:2274477 gprecoverseg:b40467422d7d:gpadmin-[INFO]:-Greenplum instance recovery parameters
20260621:22:45:36:2274477 gprecoverseg:b40467422d7d:gpadmin-[INFO]:----------------------------------------------------------
20260621:22:45:36:2274477 gprecoverseg:b40467422d7d:gpadmin-[INFO]:-Recovery from configuration -i option supplied
20260621:22:45:36:2274477 gprecoverseg:b40467422d7d:gpadmin-[INFO]:----------------------------------------------------------
20260621:22:45:36:2274477 gprecoverseg:b40467422d7d:gpadmin-[INFO]:-Recovery 1 of 1
20260621:22:45:36:2274477 gprecoverseg:b40467422d7d:gpadmin-[INFO]:----------------------------------------------------------
20260621:22:45:36:2274477 gprecoverseg:b40467422d7d:gpadmin-[INFO]:-   Synchronization mode                 = Full
20260621:22:45:36:2274477 gprecoverseg:b40467422d7d:gpadmin-[INFO]:-   Failed instance host                 = b40467422d7d
20260621:22:45:36:2274477 gprecoverseg:b40467422d7d:gpadmin-[INFO]:-   Failed instance address              = b40467422d7d
20260621:22:45:36:2274477 gprecoverseg:b40467422d7d:gpadmin-[INFO]:-   Failed instance directory            = /home/gpadmin/gpdb_src/gpAux/gpdemo/datadirs/dbfast2/demoDataDir1
20260621:22:45:36:2274477 gprecoverseg:b40467422d7d:gpadmin-[INFO]:-   Failed instance port                 = 7003
20260621:22:45:36:2274477 gprecoverseg:b40467422d7d:gpadmin-[INFO]:-   Recovery Source instance host        = b40467422d7d
20260621:22:45:36:2274477 gprecoverseg:b40467422d7d:gpadmin-[INFO]:-   Recovery Source instance address     = b40467422d7d
20260621:22:45:36:2274477 gprecoverseg:b40467422d7d:gpadmin-[INFO]:-   Recovery Source instance directory   = /home/gpadmin/gpdb_src/gpAux/gpdemo/datadirs/dbfast_mirror2/demoDataDir1
20260621:22:45:36:2274477 gprecoverseg:b40467422d7d:gpadmin-[INFO]:-   Recovery Source instance port        = 7006
20260621:22:45:36:2274477 gprecoverseg:b40467422d7d:gpadmin-[INFO]:-   Recovery Target instance host        = b40467422d7d
20260621:22:45:36:2274477 gprecoverseg:b40467422d7d:gpadmin-[INFO]:-   Recovery Target instance address     = b40467422d7d
20260621:22:45:36:2274477 gprecoverseg:b40467422d7d:gpadmin-[INFO]:-   Recovery Target instance directory   = /home/gpadmin/gpdb_src/gpAux/gpdemo/datadirs/dbfast2/demoDataDir1temp
20260621:22:45:36:2274477 gprecoverseg:b40467422d7d:gpadmin-[INFO]:-   Recovery Target instance port        = 7003
20260621:22:45:36:2274477 gprecoverseg:b40467422d7d:gpadmin-[INFO]:----------------------------------------------------------
20260621:22:45:36:2274477 gprecoverseg:b40467422d7d:gpadmin-[WARNING]:-Segment is being recovered to the same host as its primary: primary b40467422d7d:/home/gpadmin/gpdb_src/gpAux/gpdemo/datadirs/dbfast_mirror2/demoDataDir1    failover target: b40467422d7d:/home/gpadmin/gpdb_src/gpAux/gpdemo/datadirs/dbfast2/demoDataDir1temp
20260621:22:45:36:2274477 gprecoverseg:b40467422d7d:gpadmin-[INFO]:-Starting to create new pg_hba.conf on primary segments
20260621:22:45:37:2274477 gprecoverseg:b40467422d7d:gpadmin-[INFO]:-Successfully modified pg_hba.conf on primary segments to allow replication connections
20260621:22:45:37:2274477 gprecoverseg:b40467422d7d:gpadmin-[INFO]:-1 segment(s) to recover
20260621:22:45:37:2274477 gprecoverseg:b40467422d7d:gpadmin-[INFO]:-Ensuring 1 failed segment(s) are stopped
20260621:22:45:37:2274477 gprecoverseg:b40467422d7d:gpadmin-[WARNING]:-Unable to determine if /home/gpadmin/gpdb_src/gpAux/gpdemo/datadirs/dbfast2/demoDataDir1 is symlink. Assuming it is not symlink
20260621:22:45:37:2274477 gprecoverseg:b40467422d7d:gpadmin-[INFO]:-Setting up the required segments for recovery
20260621:22:45:37:2274477 gprecoverseg:b40467422d7d:gpadmin-[INFO]:-Updating configuration for mirrors
20260621:22:45:37:2274477 gprecoverseg:b40467422d7d:gpadmin-[INFO]:-Initiating segment recovery. Upon completion, will start the successfully recovered segments
20260621:22:45:37:2274477 gprecoverseg:b40467422d7d:gpadmin-[INFO]:-era is 0fce50425fae04f6_260621224434
b40467422d7d (dbid 3): pg_basebackup: base backup completed
b40467422d7d (dbid 3): pg_basebackup: base backup completed
20260621:22:45:39:2274477 gprecoverseg:b40467422d7d:gpadmin-[INFO]:-Triggering FTS probe
20260621:22:45:39:2274477 gprecoverseg:b40467422d7d:gpadmin-[INFO]:-********************************
20260621:22:45:39:2274477 gprecoverseg:b40467422d7d:gpadmin-[INFO]:-Segments successfully recovered.
20260621:22:45:39:2274477 gprecoverseg:b40467422d7d:gpadmin-[INFO]:-********************************
20260621:22:45:39:2274477 gprecoverseg:b40467422d7d:gpadmin-[INFO]:-Recovered mirror segments need to sync WAL with primary segments.
20260621:22:45:39:2274477 gprecoverseg:b40467422d7d:gpadmin-[INFO]:-Use 'gpstate -e' to check progress of WAL sync remaining bytes

-- end_ignore
(exited with code 0)

-- after gprecoverseg -i, the down segemnt should be up
-- in mirror mode
select status from gp_segment_configuration where role='m' and content=1;
 status 
--------
 u      
(1 row)

-- recover should reuse the old dbid and not occupy dbid=2
select dbid from gp_segment_configuration where dbid=2;
 dbid 
------
(0 rows)

-- recover the segment to its original datadir
!\retcode gprecoverseg -a -i /tmp/recover_config_file2;
-- start_ignore
20260621:22:45:39:2274782 gprecoverseg:b40467422d7d:gpadmin-[INFO]:-Starting gprecoverseg with args: -a -i /tmp/recover_config_file2
20260621:22:45:39:2274782 gprecoverseg:b40467422d7d:gpadmin-[INFO]:-local Greenplum Version: 'postgres (Greenplum Database) 8.0.0-alpha.0 build dev'
20260621:22:45:39:2274782 gprecoverseg:b40467422d7d:gpadmin-[INFO]:-coordinator Greenplum Version: 'PostgreSQL 15beta2 (Greenplum Database 8.0.0-alpha.0 build dev) on x86_64-pc-linux-gnu, compiled by gcc (Ubuntu 11.4.0-1ubuntu1~22.04.3) 11.4.0, 64-bit compiled on Jun 20 2026 18:57:35 (with assert checking)'
20260621:22:45:39:2274782 gprecoverseg:b40467422d7d:gpadmin-[INFO]:-Obtaining Segment details from coordinator...
20260621:22:45:40:2274782 gprecoverseg:b40467422d7d:gpadmin-[INFO]:-Heap checksum setting is consistent between coordinator and the segments that are candidates for recoverseg
20260621:22:45:40:2274782 gprecoverseg:b40467422d7d:gpadmin-[INFO]:-Greenplum instance recovery parameters
20260621:22:45:40:2274782 gprecoverseg:b40467422d7d:gpadmin-[INFO]:----------------------------------------------------------
20260621:22:45:40:2274782 gprecoverseg:b40467422d7d:gpadmin-[INFO]:-Recovery from configuration -i option supplied
20260621:22:45:40:2274782 gprecoverseg:b40467422d7d:gpadmin-[INFO]:----------------------------------------------------------
20260621:22:45:40:2274782 gprecoverseg:b40467422d7d:gpadmin-[INFO]:-Recovery 1 of 1
20260621:22:45:40:2274782 gprecoverseg:b40467422d7d:gpadmin-[INFO]:----------------------------------------------------------
20260621:22:45:40:2274782 gprecoverseg:b40467422d7d:gpadmin-[INFO]:-   Synchronization mode                 = Full
20260621:22:45:40:2274782 gprecoverseg:b40467422d7d:gpadmin-[INFO]:-   Failed instance host                 = b40467422d7d
20260621:22:45:40:2274782 gprecoverseg:b40467422d7d:gpadmin-[INFO]:-   Failed instance address              = b40467422d7d
20260621:22:45:40:2274782 gprecoverseg:b40467422d7d:gpadmin-[INFO]:-   Failed instance directory            = /home/gpadmin/gpdb_src/gpAux/gpdemo/datadirs/dbfast2/demoDataDir1temp
20260621:22:45:40:2274782 gprecoverseg:b40467422d7d:gpadmin-[INFO]:-   Failed instance port                 = 7003
20260621:22:45:40:2274782 gprecoverseg:b40467422d7d:gpadmin-[INFO]:-   Recovery Source instance host        = b40467422d7d
20260621:22:45:40:2274782 gprecoverseg:b40467422d7d:gpadmin-[INFO]:-   Recovery Source instance address     = b40467422d7d
20260621:22:45:40:2274782 gprecoverseg:b40467422d7d:gpadmin-[INFO]:-   Recovery Source instance directory   = /home/gpadmin/gpdb_src/gpAux/gpdemo/datadirs/dbfast_mirror2/demoDataDir1
20260621:22:45:40:2274782 gprecoverseg:b40467422d7d:gpadmin-[INFO]:-   Recovery Source instance port        = 7006
20260621:22:45:40:2274782 gprecoverseg:b40467422d7d:gpadmin-[INFO]:-   Recovery Target instance host        = b40467422d7d
20260621:22:45:40:2274782 gprecoverseg:b40467422d7d:gpadmin-[INFO]:-   Recovery Target instance address     = b40467422d7d
20260621:22:45:40:2274782 gprecoverseg:b40467422d7d:gpadmin-[INFO]:-   Recovery Target instance directory   = /home/gpadmin/gpdb_src/gpAux/gpdemo/datadirs/dbfast2/demoDataDir1
20260621:22:45:40:2274782 gprecoverseg:b40467422d7d:gpadmin-[INFO]:-   Recovery Target instance port        = 7003
20260621:22:45:40:2274782 gprecoverseg:b40467422d7d:gpadmin-[INFO]:----------------------------------------------------------
20260621:22:45:40:2274782 gprecoverseg:b40467422d7d:gpadmin-[WARNING]:-Segment is being recovered to the same host as its primary: primary b40467422d7d:/home/gpadmin/gpdb_src/gpAux/gpdemo/datadirs/dbfast_mirror2/demoDataDir1    failover target: b40467422d7d:/home/gpadmin/gpdb_src/gpAux/gpdemo/datadirs/dbfast2/demoDataDir1
20260621:22:45:40:2274782 gprecoverseg:b40467422d7d:gpadmin-[INFO]:-Starting to create new pg_hba.conf on primary segments
20260621:22:45:40:2274782 gprecoverseg:b40467422d7d:gpadmin-[INFO]:-Successfully modified pg_hba.conf on primary segments to allow replication connections
20260621:22:45:40:2274782 gprecoverseg:b40467422d7d:gpadmin-[INFO]:-1 segment(s) to recover
20260621:22:45:40:2274782 gprecoverseg:b40467422d7d:gpadmin-[INFO]:-Ensuring 1 failed segment(s) are stopped
20260621:22:45:40:2274782 gprecoverseg:b40467422d7d:gpadmin-[WARNING]:-Unable to determine if /home/gpadmin/gpdb_src/gpAux/gpdemo/datadirs/dbfast2/demoDataDir1temp is symlink. Assuming it is not symlink
20260621:22:45:44:2274782 gprecoverseg:b40467422d7d:gpadmin-[INFO]:-2274704: /home/gpadmin/gpdb_src/gpAux/gpdemo/datadirs/dbfast2/demoDataDir1temp
20260621:22:45:45:2274782 gprecoverseg:b40467422d7d:gpadmin-[INFO]:-Waiting for segments to be marked down.
20260621:22:45:45:2274782 gprecoverseg:b40467422d7d:gpadmin-[INFO]:-This may take up to 1800 seconds on large clusters.
........................................................
 20260621:22:46:41:2274782 gprecoverseg:b40467422d7d:gpadmin-[INFO]:-1 of 1 segments have been marked down.
20260621:22:46:41:2274782 gprecoverseg:b40467422d7d:gpadmin-[INFO]:-Setting up the required segments for recovery
20260621:22:46:41:2274782 gprecoverseg:b40467422d7d:gpadmin-[INFO]:-Updating configuration for mirrors
20260621:22:46:41:2274782 gprecoverseg:b40467422d7d:gpadmin-[INFO]:-Initiating segment recovery. Upon completion, will start the successfully recovered segments
20260621:22:46:41:2274782 gprecoverseg:b40467422d7d:gpadmin-[INFO]:-era is 0fce50425fae04f6_260621224434
b40467422d7d (dbid 3): pg_basebackup: base backup completed
20260621:22:46:42:2274782 gprecoverseg:b40467422d7d:gpadmin-[INFO]:-Triggering FTS probe
20260621:22:46:42:2274782 gprecoverseg:b40467422d7d:gpadmin-[INFO]:-********************************
20260621:22:46:42:2274782 gprecoverseg:b40467422d7d:gpadmin-[INFO]:-Segments successfully recovered.
20260621:22:46:42:2274782 gprecoverseg:b40467422d7d:gpadmin-[INFO]:-********************************
20260621:22:46:42:2274782 gprecoverseg:b40467422d7d:gpadmin-[INFO]:-Recovered mirror segments need to sync WAL with primary segments.
20260621:22:46:42:2274782 gprecoverseg:b40467422d7d:gpadmin-[INFO]:-Use 'gpstate -e' to check progress of WAL sync remaining bytes

-- end_ignore
(exited with code 0)

update gp_segment_configuration set dbid=2 where dbid=9;
UPDATE 1
set allow_system_table_mods to false;
SET

-- we manually change dbid from 2 to 9, which causes the
-- corresponding segment down as well, so recovery full
-- at here
!\retcode gprecoverseg -a;
-- start_ignore
20260621:22:46:42:2277690 gprecoverseg:b40467422d7d:gpadmin-[INFO]:-Starting gprecoverseg with args: -a
20260621:22:46:43:2277690 gprecoverseg:b40467422d7d:gpadmin-[INFO]:-local Greenplum Version: 'postgres (Greenplum Database) 8.0.0-alpha.0 build dev'
20260621:22:46:43:2277690 gprecoverseg:b40467422d7d:gpadmin-[INFO]:-coordinator Greenplum Version: 'PostgreSQL 15beta2 (Greenplum Database 8.0.0-alpha.0 build dev) on x86_64-pc-linux-gnu, compiled by gcc (Ubuntu 11.4.0-1ubuntu1~22.04.3) 11.4.0, 64-bit compiled on Jun 20 2026 18:57:35 (with assert checking)'
20260621:22:46:43:2277690 gprecoverseg:b40467422d7d:gpadmin-[INFO]:-Obtaining Segment details from coordinator...
20260621:22:46:43:2277690 gprecoverseg:b40467422d7d:gpadmin-[INFO]:-Heap checksum setting is consistent between coordinator and the segments that are candidates for recoverseg
20260621:22:46:43:2277690 gprecoverseg:b40467422d7d:gpadmin-[INFO]:-Greenplum instance recovery parameters
20260621:22:46:43:2277690 gprecoverseg:b40467422d7d:gpadmin-[INFO]:----------------------------------------------------------
20260621:22:46:43:2277690 gprecoverseg:b40467422d7d:gpadmin-[INFO]:-Recovery type              = Standard
20260621:22:46:43:2277690 gprecoverseg:b40467422d7d:gpadmin-[INFO]:----------------------------------------------------------
20260621:22:46:43:2277690 gprecoverseg:b40467422d7d:gpadmin-[INFO]:-Recovery 1 of 1
20260621:22:46:43:2277690 gprecoverseg:b40467422d7d:gpadmin-[INFO]:----------------------------------------------------------
20260621:22:46:43:2277690 gprecoverseg:b40467422d7d:gpadmin-[INFO]:-   Synchronization mode                 = Incremental
20260621:22:46:43:2277690 gprecoverseg:b40467422d7d:gpadmin-[INFO]:-   Failed instance host                 = b40467422d7d
20260621:22:46:43:2277690 gprecoverseg:b40467422d7d:gpadmin-[INFO]:-   Failed instance address              = b40467422d7d
20260621:22:46:43:2277690 gprecoverseg:b40467422d7d:gpadmin-[INFO]:-   Failed instance directory            = /home/gpadmin/gpdb_src/gpAux/gpdemo/datadirs/dbfast1/demoDataDir0
20260621:22:46:43:2277690 gprecoverseg:b40467422d7d:gpadmin-[INFO]:-   Failed instance port                 = 7002
20260621:22:46:43:2277690 gprecoverseg:b40467422d7d:gpadmin-[INFO]:-   Recovery Source instance host        = b40467422d7d
20260621:22:46:43:2277690 gprecoverseg:b40467422d7d:gpadmin-[INFO]:-   Recovery Source instance address     = b40467422d7d
20260621:22:46:43:2277690 gprecoverseg:b40467422d7d:gpadmin-[INFO]:-   Recovery Source instance directory   = /home/gpadmin/gpdb_src/gpAux/gpdemo/datadirs/dbfast_mirror1/demoDataDir0
20260621:22:46:43:2277690 gprecoverseg:b40467422d7d:gpadmin-[INFO]:-   Recovery Source instance port        = 7005
20260621:22:46:43:2277690 gprecoverseg:b40467422d7d:gpadmin-[INFO]:-   Recovery Target                      = in-place
20260621:22:46:43:2277690 gprecoverseg:b40467422d7d:gpadmin-[INFO]:----------------------------------------------------------
20260621:22:46:43:2277690 gprecoverseg:b40467422d7d:gpadmin-[INFO]:-Starting to create new pg_hba.conf on primary segments
20260621:22:46:43:2277690 gprecoverseg:b40467422d7d:gpadmin-[INFO]:-Successfully modified pg_hba.conf on primary segments to allow replication connections
20260621:22:46:43:2277690 gprecoverseg:b40467422d7d:gpadmin-[INFO]:-1 segment(s) to recover
20260621:22:46:43:2277690 gprecoverseg:b40467422d7d:gpadmin-[INFO]:-Ensuring 1 failed segment(s) are stopped
20260621:22:46:44:2277690 gprecoverseg:b40467422d7d:gpadmin-[WARNING]:-Unable to determine if /home/gpadmin/gpdb_src/gpAux/gpdemo/datadirs/dbfast1/demoDataDir0 is symlink. Assuming it is not symlink
20260621:22:46:47:2277690 gprecoverseg:b40467422d7d:gpadmin-[INFO]:-2271349: /home/gpadmin/gpdb_src/gpAux/gpdemo/datadirs/dbfast1/demoDataDir0
20260621:22:46:48:2277690 gprecoverseg:b40467422d7d:gpadmin-[INFO]:-Setting up the required segments for recovery
20260621:22:46:48:2277690 gprecoverseg:b40467422d7d:gpadmin-[INFO]:-Updating configuration for mirrors
20260621:22:46:48:2277690 gprecoverseg:b40467422d7d:gpadmin-[INFO]:-Initiating segment recovery. Upon completion, will start the successfully recovered segments
20260621:22:46:48:2277690 gprecoverseg:b40467422d7d:gpadmin-[INFO]:-era is 0fce50425fae04f6_260621224434
b40467422d7d (dbid 2): pg_rewind: Done!
20260621:22:46:49:2277690 gprecoverseg:b40467422d7d:gpadmin-[INFO]:-Triggering FTS probe
20260621:22:46:50:2277690 gprecoverseg:b40467422d7d:gpadmin-[INFO]:-********************************
20260621:22:46:50:2277690 gprecoverseg:b40467422d7d:gpadmin-[INFO]:-Segments successfully recovered.
20260621:22:46:50:2277690 gprecoverseg:b40467422d7d:gpadmin-[INFO]:-********************************
20260621:22:46:50:2277690 gprecoverseg:b40467422d7d:gpadmin-[INFO]:-Recovered mirror segments need to sync WAL with primary segments.
20260621:22:46:50:2277690 gprecoverseg:b40467422d7d:gpadmin-[INFO]:-Use 'gpstate -e' to check progress of WAL sync remaining bytes

-- end_ignore
(exited with code 0)

-- loop while segments come in sync
select wait_until_all_segments_synchronized();
 wait_until_all_segments_synchronized 
--------------------------------------
 OK                                   
(1 row)

-- rebalance the cluster
!\retcode gprecoverseg -ar;
-- start_ignore
20260621:22:46:50:2280389 gprecoverseg:b40467422d7d:gpadmin-[INFO]:-Starting gprecoverseg with args: -ar
20260621:22:46:50:2280389 gprecoverseg:b40467422d7d:gpadmin-[INFO]:-local Greenplum Version: 'postgres (Greenplum Database) 8.0.0-alpha.0 build dev'
20260621:22:46:50:2280389 gprecoverseg:b40467422d7d:gpadmin-[INFO]:-coordinator Greenplum Version: 'PostgreSQL 15beta2 (Greenplum Database 8.0.0-alpha.0 build dev) on x86_64-pc-linux-gnu, compiled by gcc (Ubuntu 11.4.0-1ubuntu1~22.04.3) 11.4.0, 64-bit compiled on Jun 20 2026 18:57:35 (with assert checking)'
20260621:22:46:50:2280389 gprecoverseg:b40467422d7d:gpadmin-[INFO]:-Obtaining Segment details from coordinator...
20260621:22:46:50:2280389 gprecoverseg:b40467422d7d:gpadmin-[INFO]:-Greenplum instance recovery parameters
20260621:22:46:50:2280389 gprecoverseg:b40467422d7d:gpadmin-[INFO]:----------------------------------------------------------
20260621:22:46:50:2280389 gprecoverseg:b40467422d7d:gpadmin-[INFO]:-Recovery type              = Rebalance
20260621:22:46:50:2280389 gprecoverseg:b40467422d7d:gpadmin-[INFO]:----------------------------------------------------------
20260621:22:46:50:2280389 gprecoverseg:b40467422d7d:gpadmin-[INFO]:-Unbalanced segment 1 of 4
20260621:22:46:50:2280389 gprecoverseg:b40467422d7d:gpadmin-[INFO]:----------------------------------------------------------
20260621:22:46:50:2280389 gprecoverseg:b40467422d7d:gpadmin-[INFO]:-   Unbalanced instance host        = b40467422d7d
20260621:22:46:50:2280389 gprecoverseg:b40467422d7d:gpadmin-[INFO]:-   Unbalanced instance address     = b40467422d7d
20260621:22:46:50:2280389 gprecoverseg:b40467422d7d:gpadmin-[INFO]:-   Unbalanced instance directory   = /home/gpadmin/gpdb_src/gpAux/gpdemo/datadirs/dbfast_mirror1/demoDataDir0
20260621:22:46:50:2280389 gprecoverseg:b40467422d7d:gpadmin-[INFO]:-   Unbalanced instance port        = 7005
20260621:22:46:50:2280389 gprecoverseg:b40467422d7d:gpadmin-[INFO]:-   Balanced role                   = Mirror
20260621:22:46:50:2280389 gprecoverseg:b40467422d7d:gpadmin-[INFO]:-   Current role                    = Primary
20260621:22:46:50:2280389 gprecoverseg:b40467422d7d:gpadmin-[INFO]:----------------------------------------------------------
20260621:22:46:50:2280389 gprecoverseg:b40467422d7d:gpadmin-[INFO]:-Unbalanced segment 2 of 4
20260621:22:46:50:2280389 gprecoverseg:b40467422d7d:gpadmin-[INFO]:----------------------------------------------------------
20260621:22:46:50:2280389 gprecoverseg:b40467422d7d:gpadmin-[INFO]:-   Unbalanced instance host        = b40467422d7d
20260621:22:46:50:2280389 gprecoverseg:b40467422d7d:gpadmin-[INFO]:-   Unbalanced instance address     = b40467422d7d
20260621:22:46:50:2280389 gprecoverseg:b40467422d7d:gpadmin-[INFO]:-   Unbalanced instance directory   = /home/gpadmin/gpdb_src/gpAux/gpdemo/datadirs/dbfast1/demoDataDir0
20260621:22:46:50:2280389 gprecoverseg:b40467422d7d:gpadmin-[INFO]:-   Unbalanced instance port        = 7002
20260621:22:46:50:2280389 gprecoverseg:b40467422d7d:gpadmin-[INFO]:-   Balanced role                   = Primary
20260621:22:46:50:2280389 gprecoverseg:b40467422d7d:gpadmin-[INFO]:-   Current role                    = Mirror
20260621:22:46:50:2280389 gprecoverseg:b40467422d7d:gpadmin-[INFO]:----------------------------------------------------------
20260621:22:46:50:2280389 gprecoverseg:b40467422d7d:gpadmin-[INFO]:-Unbalanced segment 3 of 4
20260621:22:46:50:2280389 gprecoverseg:b40467422d7d:gpadmin-[INFO]:----------------------------------------------------------
20260621:22:46:50:2280389 gprecoverseg:b40467422d7d:gpadmin-[INFO]:-   Unbalanced instance host        = b40467422d7d
20260621:22:46:50:2280389 gprecoverseg:b40467422d7d:gpadmin-[INFO]:-   Unbalanced instance address     = b40467422d7d
20260621:22:46:50:2280389 gprecoverseg:b40467422d7d:gpadmin-[INFO]:-   Unbalanced instance directory   = /home/gpadmin/gpdb_src/gpAux/gpdemo/datadirs/dbfast_mirror2/demoDataDir1
20260621:22:46:50:2280389 gprecoverseg:b40467422d7d:gpadmin-[INFO]:-   Unbalanced instance port        = 7006
20260621:22:46:50:2280389 gprecoverseg:b40467422d7d:gpadmin-[INFO]:-   Balanced role                   = Mirror
20260621:22:46:50:2280389 gprecoverseg:b40467422d7d:gpadmin-[INFO]:-   Current role                    = Primary
20260621:22:46:50:2280389 gprecoverseg:b40467422d7d:gpadmin-[INFO]:----------------------------------------------------------
20260621:22:46:50:2280389 gprecoverseg:b40467422d7d:gpadmin-[INFO]:-Unbalanced segment 4 of 4
20260621:22:46:50:2280389 gprecoverseg:b40467422d7d:gpadmin-[INFO]:----------------------------------------------------------
20260621:22:46:50:2280389 gprecoverseg:b40467422d7d:gpadmin-[INFO]:-   Unbalanced instance host        = b40467422d7d
20260621:22:46:50:2280389 gprecoverseg:b40467422d7d:gpadmin-[INFO]:-   Unbalanced instance address     = b40467422d7d
20260621:22:46:50:2280389 gprecoverseg:b40467422d7d:gpadmin-[INFO]:-   Unbalanced instance directory   = /home/gpadmin/gpdb_src/gpAux/gpdemo/datadirs/dbfast2/demoDataDir1
20260621:22:46:50:2280389 gprecoverseg:b40467422d7d:gpadmin-[INFO]:-   Unbalanced instance port        = 7003
20260621:22:46:50:2280389 gprecoverseg:b40467422d7d:gpadmin-[INFO]:-   Balanced role                   = Primary
20260621:22:46:50:2280389 gprecoverseg:b40467422d7d:gpadmin-[INFO]:-   Current role                    = Mirror
20260621:22:46:50:2280389 gprecoverseg:b40467422d7d:gpadmin-[INFO]:----------------------------------------------------------
20260621:22:46:50:2280389 gprecoverseg:b40467422d7d:gpadmin-[INFO]:-Determining primary and mirror segment pairs to rebalance
20260621:22:46:50:2280389 gprecoverseg:b40467422d7d:gpadmin-[INFO]:-Stopping unbalanced primary segments...
20260621:22:46:51:2280389 gprecoverseg:b40467422d7d:gpadmin-[INFO]:-Triggering segment reconfiguration
20260621:22:46:58:2280389 gprecoverseg:b40467422d7d:gpadmin-[INFO]:-Starting segment synchronization
20260621:22:46:58:2280389 gprecoverseg:b40467422d7d:gpadmin-[INFO]:-=============================START ANOTHER RECOVER=========================================
20260621:22:46:58:2280389 gprecoverseg:b40467422d7d:gpadmin-[INFO]:-local Greenplum Version: 'postgres (Greenplum Database) 8.0.0-alpha.0 build dev'
20260621:22:46:58:2280389 gprecoverseg:b40467422d7d:gpadmin-[INFO]:-coordinator Greenplum Version: 'PostgreSQL 15beta2 (Greenplum Database 8.0.0-alpha.0 build dev) on x86_64-pc-linux-gnu, compiled by gcc (Ubuntu 11.4.0-1ubuntu1~22.04.3) 11.4.0, 64-bit compiled on Jun 20 2026 18:57:35 (with assert checking)'
20260621:22:46:58:2280389 gprecoverseg:b40467422d7d:gpadmin-[INFO]:-Obtaining Segment details from coordinator...
20260621:22:46:58:2280389 gprecoverseg:b40467422d7d:gpadmin-[INFO]:-Heap checksum setting is consistent between coordinator and the segments that are candidates for recoverseg
20260621:22:46:58:2280389 gprecoverseg:b40467422d7d:gpadmin-[INFO]:-Greenplum instance recovery parameters
20260621:22:46:58:2280389 gprecoverseg:b40467422d7d:gpadmin-[INFO]:----------------------------------------------------------
20260621:22:46:58:2280389 gprecoverseg:b40467422d7d:gpadmin-[INFO]:-Recovery type              = Standard
20260621:22:46:58:2280389 gprecoverseg:b40467422d7d:gpadmin-[INFO]:----------------------------------------------------------
20260621:22:46:58:2280389 gprecoverseg:b40467422d7d:gpadmin-[INFO]:-Recovery 1 of 2
20260621:22:46:58:2280389 gprecoverseg:b40467422d7d:gpadmin-[INFO]:----------------------------------------------------------
20260621:22:46:58:2280389 gprecoverseg:b40467422d7d:gpadmin-[INFO]:-   Synchronization mode                 = Incremental
20260621:22:46:58:2280389 gprecoverseg:b40467422d7d:gpadmin-[INFO]:-   Failed instance host                 = b40467422d7d
20260621:22:46:58:2280389 gprecoverseg:b40467422d7d:gpadmin-[INFO]:-   Failed instance address              = b40467422d7d
20260621:22:46:58:2280389 gprecoverseg:b40467422d7d:gpadmin-[INFO]:-   Failed instance directory            = /home/gpadmin/gpdb_src/gpAux/gpdemo/datadirs/dbfast_mirror1/demoDataDir0
20260621:22:46:58:2280389 gprecoverseg:b40467422d7d:gpadmin-[INFO]:-   Failed instance port                 = 7005
20260621:22:46:58:2280389 gprecoverseg:b40467422d7d:gpadmin-[INFO]:-   Recovery Source instance host        = b40467422d7d
20260621:22:46:58:2280389 gprecoverseg:b40467422d7d:gpadmin-[INFO]:-   Recovery Source instance address     = b40467422d7d
20260621:22:46:58:2280389 gprecoverseg:b40467422d7d:gpadmin-[INFO]:-   Recovery Source instance directory   = /home/gpadmin/gpdb_src/gpAux/gpdemo/datadirs/dbfast1/demoDataDir0
20260621:22:46:58:2280389 gprecoverseg:b40467422d7d:gpadmin-[INFO]:-   Recovery Source instance port        = 7002
20260621:22:46:58:2280389 gprecoverseg:b40467422d7d:gpadmin-[INFO]:-   Recovery Target                      = in-place
20260621:22:46:58:2280389 gprecoverseg:b40467422d7d:gpadmin-[INFO]:----------------------------------------------------------
20260621:22:46:58:2280389 gprecoverseg:b40467422d7d:gpadmin-[INFO]:-Recovery 2 of 2
20260621:22:46:58:2280389 gprecoverseg:b40467422d7d:gpadmin-[INFO]:----------------------------------------------------------
20260621:22:46:58:2280389 gprecoverseg:b40467422d7d:gpadmin-[INFO]:-   Synchronization mode                 = Incremental
20260621:22:46:58:2280389 gprecoverseg:b40467422d7d:gpadmin-[INFO]:-   Failed instance host                 = b40467422d7d
20260621:22:46:58:2280389 gprecoverseg:b40467422d7d:gpadmin-[INFO]:-   Failed instance address              = b40467422d7d
20260621:22:46:58:2280389 gprecoverseg:b40467422d7d:gpadmin-[INFO]:-   Failed instance directory            = /home/gpadmin/gpdb_src/gpAux/gpdemo/datadirs/dbfast_mirror2/demoDataDir1
20260621:22:46:58:2280389 gprecoverseg:b40467422d7d:gpadmin-[INFO]:-   Failed instance port                 = 7006
20260621:22:46:58:2280389 gprecoverseg:b40467422d7d:gpadmin-[INFO]:-   Recovery Source instance host        = b40467422d7d
20260621:22:46:58:2280389 gprecoverseg:b40467422d7d:gpadmin-[INFO]:-   Recovery Source instance address     = b40467422d7d
20260621:22:46:58:2280389 gprecoverseg:b40467422d7d:gpadmin-[INFO]:-   Recovery Source instance directory   = /home/gpadmin/gpdb_src/gpAux/gpdemo/datadirs/dbfast2/demoDataDir1
20260621:22:46:58:2280389 gprecoverseg:b40467422d7d:gpadmin-[INFO]:-   Recovery Source instance port        = 7003
20260621:22:46:58:2280389 gprecoverseg:b40467422d7d:gpadmin-[INFO]:-   Recovery Target                      = in-place
20260621:22:46:58:2280389 gprecoverseg:b40467422d7d:gpadmin-[INFO]:----------------------------------------------------------
20260621:22:46:58:2280389 gprecoverseg:b40467422d7d:gpadmin-[INFO]:-Starting to create new pg_hba.conf on primary segments
20260621:22:46:59:2280389 gprecoverseg:b40467422d7d:gpadmin-[INFO]:-Successfully modified pg_hba.conf on primary segments to allow replication connections
20260621:22:46:59:2280389 gprecoverseg:b40467422d7d:gpadmin-[INFO]:-2 segment(s) to recover
20260621:22:46:59:2280389 gprecoverseg:b40467422d7d:gpadmin-[INFO]:-Ensuring 2 failed segment(s) are stopped
20260621:22:46:59:2280389 gprecoverseg:b40467422d7d:gpadmin-[WARNING]:-Unable to determine if /home/gpadmin/gpdb_src/gpAux/gpdemo/datadirs/dbfast_mirror1/demoDataDir0 is symlink. Assuming it is not symlink
20260621:22:46:59:2280389 gprecoverseg:b40467422d7d:gpadmin-[WARNING]:-Unable to determine if /home/gpadmin/gpdb_src/gpAux/gpdemo/datadirs/dbfast_mirror2/demoDataDir1 is symlink. Assuming it is not symlink
20260621:22:46:59:2280389 gprecoverseg:b40467422d7d:gpadmin-[INFO]:-Setting up the required segments for recovery
20260621:22:47:00:2280389 gprecoverseg:b40467422d7d:gpadmin-[INFO]:-Updating configuration for mirrors
20260621:22:47:00:2280389 gprecoverseg:b40467422d7d:gpadmin-[INFO]:-Initiating segment recovery. Upon completion, will start the successfully recovered segments
20260621:22:47:00:2280389 gprecoverseg:b40467422d7d:gpadmin-[INFO]:-era is 0fce50425fae04f6_260621224434
b40467422d7d (dbid 5): pg_rewind: no rewind required
b40467422d7d (dbid 6): pg_rewind: no rewind required
20260621:22:47:01:2280389 gprecoverseg:b40467422d7d:gpadmin-[INFO]:-Triggering FTS probe
20260621:22:47:01:2280389 gprecoverseg:b40467422d7d:gpadmin-[INFO]:-********************************
20260621:22:47:01:2280389 gprecoverseg:b40467422d7d:gpadmin-[INFO]:-Segments successfully recovered.
20260621:22:47:01:2280389 gprecoverseg:b40467422d7d:gpadmin-[INFO]:-********************************
20260621:22:47:01:2280389 gprecoverseg:b40467422d7d:gpadmin-[INFO]:-Recovered mirror segments need to sync WAL with primary segments.
20260621:22:47:01:2280389 gprecoverseg:b40467422d7d:gpadmin-[INFO]:-Use 'gpstate -e' to check progress of WAL sync remaining bytes
20260621:22:47:01:2280389 gprecoverseg:b40467422d7d:gpadmin-[INFO]:-==============================END ANOTHER RECOVER==========================================
20260621:22:47:01:2280389 gprecoverseg:b40467422d7d:gpadmin-[INFO]:-******************************************************************
20260621:22:47:01:2280389 gprecoverseg:b40467422d7d:gpadmin-[INFO]:-The rebalance operation has completed successfully.
20260621:22:47:01:2280389 gprecoverseg:b40467422d7d:gpadmin-[INFO]:-******************************************************************

-- end_ignore
(exited with code 0)

-- loop while segments come in sync
select wait_until_all_segments_synchronized();
 wait_until_all_segments_synchronized 
--------------------------------------
 OK                                   
(1 row)

-- recheck gp_segment_configuration after rebalance
SELECT dbid, role, preferred_role, content, mode, status FROM gp_segment_configuration order by dbid;
 dbid | role | preferred_role | content | mode | status 
------+------+----------------+---------+------+--------
 1    | p    | p              | -1      | n    | u      
 2    | p    | p              | 0       | s    | u      
 3    | p    | p              | 1       | s    | u      
 4    | p    | p              | 2       | s    | u      
 5    | m    | m              | 0       | s    | u      
 6    | m    | m              | 1       | s    | u      
 7    | m    | m              | 2       | s    | u      
 8    | m    | m              | -1      | s    | u      
(8 rows)

-- remove recovered segment's temp datadir
!\retcode rm -rf `cat /tmp/recover_config_file2 | awk 'BEGIN {FS=" "}  {print $1}' | awk 'BEGIN {FS="|"}  {print $3}'`;
-- start_ignore

-- end_ignore
(exited with code 0)
-- remove the config file
!\retcode rm /tmp/recover_config_file1;
-- start_ignore

-- end_ignore
(exited with code 0)
!\retcode rm /tmp/recover_config_file2;
-- start_ignore

-- end_ignore
(exited with code 0)
