--
-- BTREE_INDEX
--
-- directory paths are passed to us in environment variables
\getenv abs_srcdir PG_ABS_SRCDIR
CREATE TABLE bt_i4_heap (
	seqno 		int4,
	random 		int4
);
NOTICE:  Table doesn't have 'DISTRIBUTED BY' clause -- Using column named 'seqno' as the Greenplum Database data distribution key for this table.
HINT:  The 'DISTRIBUTED BY' clause determines the distribution of data. Make sure column(s) chosen are the optimal data distribution key to minimize skew.
CREATE TABLE bt_name_heap (
	seqno 		name,
	random 		int4
);
NOTICE:  Table doesn't have 'DISTRIBUTED BY' clause -- Using column named 'seqno' as the Greenplum Database data distribution key for this table.
HINT:  The 'DISTRIBUTED BY' clause determines the distribution of data. Make sure column(s) chosen are the optimal data distribution key to minimize skew.
CREATE TABLE bt_txt_heap (
	seqno 		text,
	random 		int4
);
NOTICE:  Table doesn't have 'DISTRIBUTED BY' clause -- Using column named 'seqno' as the Greenplum Database data distribution key for this table.
HINT:  The 'DISTRIBUTED BY' clause determines the distribution of data. Make sure column(s) chosen are the optimal data distribution key to minimize skew.
CREATE TABLE bt_f8_heap (
	seqno 		float8,
	random 		int4
);
NOTICE:  Table doesn't have 'DISTRIBUTED BY' clause -- Using column named 'seqno' as the Greenplum Database data distribution key for this table.
HINT:  The 'DISTRIBUTED BY' clause determines the distribution of data. Make sure column(s) chosen are the optimal data distribution key to minimize skew.
\set filename :abs_srcdir '/data/desc.data'
COPY bt_i4_heap FROM :'filename';
\set filename :abs_srcdir '/data/hash.data'
COPY bt_name_heap FROM :'filename';
\set filename :abs_srcdir '/data/desc.data'
COPY bt_txt_heap FROM :'filename';
\set filename :abs_srcdir '/data/hash.data'
COPY bt_f8_heap FROM :'filename';
ANALYZE bt_i4_heap;
ANALYZE bt_name_heap;
ANALYZE bt_txt_heap;
ANALYZE bt_f8_heap;
--
-- BTREE ascending/descending cases
--
-- we load int4/text from pure descending data (each key is a new
-- low key) and name/f8 from pure ascending data (each key is a new
-- high key).  we had a bug where new low keys would sometimes be
-- "lost".
--
CREATE INDEX bt_i4_index ON bt_i4_heap USING btree (seqno int4_ops);
CREATE INDEX bt_name_index ON bt_name_heap USING btree (seqno name_ops);
CREATE INDEX bt_txt_index ON bt_txt_heap USING btree (seqno text_ops);
CREATE INDEX bt_f8_index ON bt_f8_heap USING btree (seqno float8_ops);
--
-- test retrieval of min/max keys for each index
--
SELECT b.*
   FROM bt_i4_heap b
   WHERE b.seqno < 1;
 seqno |   random   
-------+------------
     0 | 1935401906
(1 row)

SELECT b.*
   FROM bt_i4_heap b
   WHERE b.seqno >= 9999;
 seqno |   random   
-------+------------
  9999 | 1227676208
(1 row)

SELECT b.*
   FROM bt_i4_heap b
   WHERE b.seqno = 4500;
 seqno |   random   
-------+------------
  4500 | 2080851358
(1 row)

SELECT b.*
   FROM bt_name_heap b
   WHERE b.seqno < '1'::name;
 seqno |   random   
-------+------------
 0     | 1935401906
(1 row)

SELECT b.*
   FROM bt_name_heap b
   WHERE b.seqno >= '9999'::name;
 seqno |   random   
-------+------------
 9999  | 1227676208
(1 row)

SELECT b.*
   FROM bt_name_heap b
   WHERE b.seqno = '4500'::name;
 seqno |   random   
-------+------------
 4500  | 2080851358
(1 row)

SELECT b.*
   FROM bt_txt_heap b
   WHERE b.seqno < '1'::text;
 seqno |   random   
-------+------------
 0     | 1935401906
(1 row)

SELECT b.*
   FROM bt_txt_heap b
   WHERE b.seqno >= '9999'::text;
 seqno |   random   
-------+------------
 9999  | 1227676208
(1 row)

SELECT b.*
   FROM bt_txt_heap b
   WHERE b.seqno = '4500'::text;
 seqno |   random   
-------+------------
 4500  | 2080851358
(1 row)

SELECT b.*
   FROM bt_f8_heap b
   WHERE b.seqno < '1'::float8;
 seqno |   random   
-------+------------
     0 | 1935401906
(1 row)

SELECT b.*
   FROM bt_f8_heap b
   WHERE b.seqno >= '9999'::float8;
 seqno |   random   
-------+------------
  9999 | 1227676208
(1 row)

SELECT b.*
   FROM bt_f8_heap b
   WHERE b.seqno = '4500'::float8;
 seqno |   random   
-------+------------
  4500 | 2080851358
(1 row)

--
-- Add coverage of RowCompare quals whose row omits a column ("proargtypes")
-- that's after the first column, but before the final column.  The scan's
-- initial positioning strategy must become >= here (it's not the > strategy,
-- since the absence of "proargtypes" makes that tighter constraint unsafe).
--
-- GPDB: these RowCompare tests scan pg_proc, whose contents (the functions that
-- sort just after 'abs') and index/scan plan both change as the parallel
-- schedule creates and drops functions, so both the result and the plan flutter.
-- start_ignore
explain (costs off)
SELECT proname, proargtypes, pronamespace
   FROM pg_proc
   WHERE (proname, pronamespace) > ('abs', 0)
ORDER BY proname, proargtypes, pronamespace LIMIT 1;
                                  QUERY PLAN                                   
-------------------------------------------------------------------------------
 Limit
   ->  Index Only Scan using pg_proc_proname_args_nsp_index on pg_proc
         Index Cond: (ROW(proname, pronamespace) > ROW('abs'::name, '0'::oid))
 Optimizer: Postgres query optimizer
(4 rows)

SELECT proname, proargtypes, pronamespace
   FROM pg_proc
   WHERE (proname, pronamespace) > ('abs', 0)
ORDER BY proname, proargtypes, pronamespace LIMIT 1;
 proname | proargtypes | pronamespace 
---------+-------------+--------------
 abs     | 20          |           11
(1 row)

--
-- Similar to the previous test case, but this time it's a backwards scan
-- using a < RowCompare.  Must use the <= strategy (and not the < strategy).
--
explain (costs off)
SELECT proname, proargtypes, pronamespace
   FROM pg_proc
   WHERE (proname, pronamespace) < ('abs', 1_000_000)
ORDER BY proname DESC, proargtypes DESC, pronamespace DESC LIMIT 1;
                                     QUERY PLAN                                      
-------------------------------------------------------------------------------------
 Limit
   ->  Index Only Scan Backward using pg_proc_proname_args_nsp_index on pg_proc
         Index Cond: (ROW(proname, pronamespace) < ROW('abs'::name, '1000000'::oid))
 Optimizer: Postgres query optimizer
(4 rows)

SELECT proname, proargtypes, pronamespace
   FROM pg_proc
   WHERE (proname, pronamespace) < ('abs', 1_000_000)
ORDER BY proname DESC, proargtypes DESC, pronamespace DESC LIMIT 1;
 proname | proargtypes | pronamespace 
---------+-------------+--------------
 abs     | 7198        |           11
(1 row)

--
-- Add coverage for RowCompare quals whose rhs row has a NULL that ends scan
--
explain (costs off)
SELECT proname, proargtypes, pronamespace
   FROM pg_proc
   WHERE proname = 'abs' AND (proname, proargtypes) < ('abs', NULL)
ORDER BY proname, proargtypes, pronamespace;
                                                 QUERY PLAN                                                  
-------------------------------------------------------------------------------------------------------------
 Index Only Scan using pg_proc_proname_args_nsp_index on pg_proc
   Index Cond: ((ROW(proname, proargtypes) < ROW('abs'::name, NULL::oidvector)) AND (proname = 'abs'::name))
 Optimizer: Postgres query optimizer
(3 rows)

SELECT proname, proargtypes, pronamespace
   FROM pg_proc
   WHERE proname = 'abs' AND (proname, proargtypes) < ('abs', NULL)
ORDER BY proname, proargtypes, pronamespace;
 proname | proargtypes | pronamespace 
---------+-------------+--------------
(0 rows)

--
-- Add coverage for backwards scan RowCompare quals whose rhs row has a NULL
-- that ends scan
--
explain (costs off)
SELECT proname, proargtypes, pronamespace
   FROM pg_proc
   WHERE proname = 'abs' AND (proname, proargtypes) > ('abs', NULL)
ORDER BY proname DESC, proargtypes DESC, pronamespace DESC;
                                                 QUERY PLAN                                                  
-------------------------------------------------------------------------------------------------------------
 Index Only Scan Backward using pg_proc_proname_args_nsp_index on pg_proc
   Index Cond: ((ROW(proname, proargtypes) > ROW('abs'::name, NULL::oidvector)) AND (proname = 'abs'::name))
 Optimizer: Postgres query optimizer
(3 rows)

SELECT proname, proargtypes, pronamespace
   FROM pg_proc
   WHERE proname = 'abs' AND (proname, proargtypes) > ('abs', NULL)
ORDER BY proname DESC, proargtypes DESC, pronamespace DESC;
 proname | proargtypes | pronamespace 
---------+-------------+--------------
(0 rows)

-- end_ignore
--
-- Add coverage for recheck of > key following array advancement on previous
-- (left sibling) page that used a high key whose attribute value corresponding
-- to the > key was -inf (due to being truncated when the high key was created).
--
-- XXX This relies on the assumption that tenk1_thous_tenthous has a truncated
-- high key "(183, -inf)" on the first page that we'll scan.  The test will only
-- provide useful coverage when the default 8K BLCKSZ is in use.
--
explain (costs off)
SELECT thousand, tenthous
  FROM tenk1
  WHERE thousand IN (182, 183) AND tenthous > 7550;
                        QUERY PLAN                         
-----------------------------------------------------------
 Gather Motion 3:1  (slice1; segments: 3)
   ->  Index Scan using tenk1_thous_tenthous on tenk1
         Index Cond: (tenthous > 7550)
         Filter: (thousand = ANY ('{182,183}'::integer[]))
 Optimizer: Pivotal Optimizer (GPORCA)
(5 rows)

SELECT thousand, tenthous
  FROM tenk1
  WHERE thousand IN (182, 183) AND tenthous > 7550;
 thousand | tenthous 
----------+----------
      182 |     9182
      183 |     8183
      183 |     9183
      182 |     8182
(4 rows)

--
-- Add coverage for optimization of backwards scan index descents
--
-- Here we expect _bt_search to descend straight to a leaf page containing a
-- non-pivot tuple with the value '47', which comes last (after 11 similar
-- non-pivot tuples).  Query execution should only need to visit a single
-- leaf page here.
--
-- Test case relies on tenk1_hundred index having a leaf page whose high key
-- is '(48, -inf)'.  We use a low cardinality index to make our test case less
-- sensitive to implementation details that may change in the future.
set enable_seqscan to false;
set enable_indexscan to true;
set enable_bitmapscan to false;
explain (costs off)
select hundred, twenty from tenk1 where hundred < 48 order by hundred desc limit 1;
                           QUERY PLAN                            
-----------------------------------------------------------------
 Limit
   ->  Gather Motion 3:1  (slice1; segments: 3)
         Merge Key: hundred
         ->  Limit
               ->  Sort
                     Sort Key: hundred DESC
                     ->  Index Scan using tenk1_hundred on tenk1
                           Index Cond: (hundred < 48)
 Optimizer: Pivotal Optimizer (GPORCA)
(9 rows)

select hundred, twenty from tenk1 where hundred < 48 order by hundred desc limit 1;
 hundred | twenty 
---------+--------
      47 |      7
(1 row)

-- This variant of the query need only return a single tuple located to the immediate
-- right of the '(48, -inf)' high key.  It also only needs to scan one single
-- leaf page (the right sibling of the page scanned by the last test case):
explain (costs off)
select hundred, twenty from tenk1 where hundred <= 48 order by hundred desc limit 1;
                           QUERY PLAN                            
-----------------------------------------------------------------
 Limit
   ->  Gather Motion 3:1  (slice1; segments: 3)
         Merge Key: hundred
         ->  Limit
               ->  Sort
                     Sort Key: hundred DESC
                     ->  Index Scan using tenk1_hundred on tenk1
                           Index Cond: (hundred <= 48)
 Optimizer: Pivotal Optimizer (GPORCA)
(9 rows)

select hundred, twenty from tenk1 where hundred <= 48 order by hundred desc limit 1;
 hundred | twenty 
---------+--------
      48 |      8
(1 row)

--
-- Add coverage for ScalarArrayOp btree quals with pivot tuple constants
--
explain (costs off)
select distinct hundred from tenk1 where hundred in (47, 48, 72, 82);
                                           QUERY PLAN                                           
------------------------------------------------------------------------------------------------
 Gather Motion 3:1  (slice1; segments: 3)
   ->  GroupAggregate
         Group Key: hundred
         ->  Sort
               Sort Key: hundred
               ->  Redistribute Motion 3:3  (slice2; segments: 3)
                     Hash Key: hundred
                     ->  Streaming HashAggregate
                           Group Key: hundred
                           ->  Bitmap Heap Scan on tenk1
                                 Recheck Cond: (hundred = ANY ('{47,48,72,82}'::integer[]))
                                 ->  Bitmap Index Scan on tenk1_hundred
                                       Index Cond: (hundred = ANY ('{47,48,72,82}'::integer[]))
 Optimizer: Pivotal Optimizer (GPORCA)
(14 rows)

select distinct hundred from tenk1 where hundred in (47, 48, 72, 82);
 hundred 
---------
      47
      48
      72
      82
(4 rows)

explain (costs off)
select distinct hundred from tenk1 where hundred in (47, 48, 72, 82) order by hundred desc;
                                           QUERY PLAN                                           
------------------------------------------------------------------------------------------------
 Gather Motion 3:1  (slice1; segments: 3)
   Merge Key: hundred
   ->  GroupAggregate
         Group Key: hundred
         ->  Sort
               Sort Key: hundred DESC
               ->  Redistribute Motion 3:3  (slice2; segments: 3)
                     Hash Key: hundred
                     ->  Streaming HashAggregate
                           Group Key: hundred
                           ->  Bitmap Heap Scan on tenk1
                                 Recheck Cond: (hundred = ANY ('{47,48,72,82}'::integer[]))
                                 ->  Bitmap Index Scan on tenk1_hundred
                                       Index Cond: (hundred = ANY ('{47,48,72,82}'::integer[]))
 Optimizer: Pivotal Optimizer (GPORCA)
(15 rows)

select distinct hundred from tenk1 where hundred in (47, 48, 72, 82) order by hundred desc;
 hundred 
---------
      82
      72
      48
      47
(4 rows)

explain (costs off)
select thousand from tenk1 where thousand in (364, 366,380) and tenthous = 200000;
                          QUERY PLAN                           
---------------------------------------------------------------
 Gather Motion 3:1  (slice1; segments: 3)
   ->  Index Scan using tenk1_thous_tenthous on tenk1
         Index Cond: (tenthous = 200000)
         Filter: (thousand = ANY ('{364,366,380}'::integer[]))
 Optimizer: Pivotal Optimizer (GPORCA)
(5 rows)

select thousand from tenk1 where thousand in (364, 366,380) and tenthous = 200000;
 thousand 
----------
(0 rows)

--
-- Check correct optimization of LIKE (special index operator support)
-- for both indexscan and bitmapscan cases
--
set enable_seqscan to false;
set enable_indexscan to true;
set enable_bitmapscan to false;
set enable_sort to false; -- GPDB needs more strong-arming to get same plans as upstream
explain (costs off)
select proname from pg_proc where proname like E'RI\\_FKey%del' order by 1;
                                  QUERY PLAN                                  
------------------------------------------------------------------------------
 Index Only Scan using pg_proc_proname_args_nsp_index on pg_proc
   Index Cond: ((proname >= 'RI_FKey'::text) AND (proname < 'RI_FKez'::text))
   Filter: (proname ~~ 'RI\_FKey%del'::text)
 Optimizer: Postgres query optimizer
(4 rows)

select proname from pg_proc where proname like E'RI\\_FKey%del' order by 1;
        proname         
------------------------
 RI_FKey_cascade_del
 RI_FKey_noaction_del
 RI_FKey_restrict_del
 RI_FKey_setdefault_del
 RI_FKey_setnull_del
(5 rows)

explain (costs off)
select proname from pg_proc where proname ilike '00%foo' order by 1;
                             QUERY PLAN                             
--------------------------------------------------------------------
 Index Only Scan using pg_proc_proname_args_nsp_index on pg_proc
   Index Cond: ((proname >= '00'::text) AND (proname < '01'::text))
   Filter: (proname ~~* '00%foo'::text)
 Optimizer: Postgres query optimizer
(4 rows)

select proname from pg_proc where proname ilike '00%foo' order by 1;
 proname 
---------
(0 rows)

explain (costs off)
select proname from pg_proc where proname ilike 'ri%foo' order by 1;
                           QUERY PLAN                            
-----------------------------------------------------------------
 Index Only Scan using pg_proc_proname_args_nsp_index on pg_proc
   Filter: (proname ~~* 'ri%foo'::text)
 Optimizer: Postgres query optimizer
(3 rows)

set enable_indexscan to false;
set enable_bitmapscan to true;
reset enable_sort;
explain (costs off)
select proname from pg_proc where proname like E'RI\\_FKey%del' order by 1;
                                        QUERY PLAN                                        
------------------------------------------------------------------------------------------
 Sort
   Sort Key: proname
   ->  Bitmap Heap Scan on pg_proc
         Filter: (proname ~~ 'RI\_FKey%del'::text)
         ->  Bitmap Index Scan on pg_proc_proname_args_nsp_index
               Index Cond: ((proname >= 'RI_FKey'::text) AND (proname < 'RI_FKez'::text))
 Optimizer: Postgres query optimizer
(7 rows)

select proname from pg_proc where proname like E'RI\\_FKey%del' order by 1;
        proname         
------------------------
 RI_FKey_cascade_del
 RI_FKey_noaction_del
 RI_FKey_restrict_del
 RI_FKey_setdefault_del
 RI_FKey_setnull_del
(5 rows)

explain (costs off)
select proname from pg_proc where proname ilike '00%foo' order by 1;
                                   QUERY PLAN                                   
--------------------------------------------------------------------------------
 Sort
   Sort Key: proname
   ->  Bitmap Heap Scan on pg_proc
         Filter: (proname ~~* '00%foo'::text)
         ->  Bitmap Index Scan on pg_proc_proname_args_nsp_index
               Index Cond: ((proname >= '00'::text) AND (proname < '01'::text))
 Optimizer: Postgres query optimizer
(7 rows)

select proname from pg_proc where proname ilike '00%foo' order by 1;
 proname 
---------
(0 rows)

set enable_sort to false; -- GPDB needs more strong-arming to get same plans as upstream
set enable_bitmapscan to false;
explain (costs off)
select proname from pg_proc where proname ilike 'ri%foo' order by 1;
                           QUERY PLAN                            
-----------------------------------------------------------------
 Index Only Scan using pg_proc_proname_args_nsp_index on pg_proc
   Disabled: true
   Filter: (proname ~~* 'ri%foo'::text)
 Optimizer: Postgres query optimizer
(4 rows)

reset enable_seqscan;
reset enable_indexscan;
reset enable_bitmapscan;
reset enable_sort;
-- Also check LIKE optimization with binary-compatible cases
create temp table btree_bpchar (f1 text collate "C");
NOTICE:  Table doesn't have 'DISTRIBUTED BY' clause -- Using column named 'f1' as the Greenplum Database data distribution key for this table.
HINT:  The 'DISTRIBUTED BY' clause determines the distribution of data. Make sure column(s) chosen are the optimal data distribution key to minimize skew.
create index on btree_bpchar(f1 bpchar_ops) WITH (deduplicate_items=on);
insert into btree_bpchar values ('foo'), ('fool'), ('bar'), ('quux');
-- doesn't match index:
explain (costs off)
select * from btree_bpchar where f1 like 'foo';
                QUERY PLAN                
------------------------------------------
 Gather Motion 3:1  (slice1; segments: 3)
   ->  Seq Scan on btree_bpchar
         Filter: (f1 ~~ 'foo'::text)
 Optimizer: Postgres query optimizer
(4 rows)

select * from btree_bpchar where f1 like 'foo';
 f1  
-----
 foo
(1 row)

explain (costs off)
select * from btree_bpchar where f1 like 'foo%';
                QUERY PLAN                
------------------------------------------
 Gather Motion 3:1  (slice1; segments: 3)
   ->  Seq Scan on btree_bpchar
         Filter: (f1 ~~ 'foo%'::text)
 Optimizer: Postgres query optimizer
(4 rows)

select * from btree_bpchar where f1 like 'foo%';
  f1  
------
 foo
 fool
(2 rows)

-- these do match the index:
explain (costs off)
select * from btree_bpchar where f1::bpchar like 'foo';
                        QUERY PLAN                        
----------------------------------------------------------
 Gather Motion 1:1  (slice1; segments: 1)
   ->  Bitmap Heap Scan on btree_bpchar
         Filter: ((f1)::bpchar ~~ 'foo'::text)
         ->  Bitmap Index Scan on btree_bpchar_f1_idx
               Index Cond: ((f1)::bpchar = 'foo'::bpchar)
 Optimizer: Postgres query optimizer
(6 rows)

select * from btree_bpchar where f1::bpchar like 'foo';
 f1  
-----
 foo
(1 row)

explain (costs off)
select * from btree_bpchar where f1::bpchar like 'foo%';
                                           QUERY PLAN                                           
------------------------------------------------------------------------------------------------
 Gather Motion 3:1  (slice1; segments: 3)
   ->  Bitmap Heap Scan on btree_bpchar
         Filter: ((f1)::bpchar ~~ 'foo%'::text)
         ->  Bitmap Index Scan on btree_bpchar_f1_idx
               Index Cond: (((f1)::bpchar >= 'foo'::bpchar) AND ((f1)::bpchar < 'fop'::bpchar))
 Optimizer: Postgres query optimizer
(6 rows)

select * from btree_bpchar where f1::bpchar like 'foo%';
  f1  
------
 foo
 fool
(2 rows)

-- get test coverage for "single value" deduplication strategy:
insert into btree_bpchar select 'foo' from generate_series(1,1500);
--
-- Perform unique checking, with and without the use of deduplication
--
CREATE TABLE dedup_unique_test_table (a int) WITH (autovacuum_enabled=false);
NOTICE:  Table doesn't have 'DISTRIBUTED BY' clause -- Using column named 'a' as the Greenplum Database data distribution key for this table.
HINT:  The 'DISTRIBUTED BY' clause determines the distribution of data. Make sure column(s) chosen are the optimal data distribution key to minimize skew.
CREATE UNIQUE INDEX dedup_unique ON dedup_unique_test_table (a) WITH (deduplicate_items=on);
CREATE UNIQUE INDEX plain_unique ON dedup_unique_test_table (a) WITH (deduplicate_items=off);
-- Generate enough garbage tuples in index to ensure that even the unique index
-- with deduplication enabled has to check multiple leaf pages during unique
-- checking (at least with a BLCKSZ of 8192 or less)
DO $$
BEGIN
    FOR r IN 1..1350 LOOP
        DELETE FROM dedup_unique_test_table;
        INSERT INTO dedup_unique_test_table SELECT 1;
    END LOOP;
END$$;
-- Exercise the LP_DEAD-bit-set tuple deletion code with a posting list tuple.
-- The implementation prefers deleting existing items to merging any duplicate
-- tuples into a posting list, so we need an explicit test to make sure we get
-- coverage (note that this test also assumes BLCKSZ is 8192 or less):
DROP INDEX plain_unique;
DELETE FROM dedup_unique_test_table WHERE a = 1;
INSERT INTO dedup_unique_test_table SELECT i FROM generate_series(0,450) i;
--
-- Test B-tree fast path (cache rightmost leaf page) optimization.
--
-- First create a tree that's at least three levels deep (i.e. has one level
-- between the root and leaf levels). The text inserted is long.  It won't be
-- TOAST compressed because we use plain storage in the table.  Only a few
-- index tuples fit on each internal page, allowing us to get a tall tree with
-- few pages.  (A tall tree is required to trigger caching.)
--
-- The text column must be the leading column in the index, since suffix
-- truncation would otherwise truncate tuples on internal pages, leaving us
-- with a short tree.
create table btree_tall_tbl(id int4, t text);
NOTICE:  Table doesn't have 'DISTRIBUTED BY' clause -- Using column named 'id' as the Greenplum Database data distribution key for this table.
HINT:  The 'DISTRIBUTED BY' clause determines the distribution of data. Make sure column(s) chosen are the optimal data distribution key to minimize skew.
alter table btree_tall_tbl alter COLUMN t set storage plain;
create index btree_tall_idx on btree_tall_tbl (t, id) with (fillfactor = 10);
insert into btree_tall_tbl select g, repeat('x', 250)
from generate_series(1, 130) g;
insert into btree_tall_tbl select g, NULL
from generate_series(50, 60) g;
--
-- Test for skip scan with type that lacks skip support (text)
--
set enable_seqscan to false;
set enable_bitmapscan to false;
-- Forwards scan
SELECT id FROM btree_tall_tbl WHERE id = 55 ORDER BY t, id;
 id 
----
 55
 55
(2 rows)

explain (costs off)
SELECT id FROM btree_tall_tbl WHERE id = 55 ORDER BY t, id;
                          QUERY PLAN                           
---------------------------------------------------------------
 Result
   ->  Gather Motion 1:1  (slice1; segments: 1)
         Merge Key: t, id
         ->  Index Scan using btree_tall_idx on btree_tall_tbl
               Index Cond: (id = 55)
 Optimizer: Pivotal Optimizer (GPORCA)
(6 rows)

-- Backwards scan
SELECT id FROM btree_tall_tbl WHERE id = 55 ORDER BY t DESC, id DESC;
 id 
----
 55
 55
(2 rows)

explain (costs off)
SELECT id FROM btree_tall_tbl WHERE id = 55 ORDER BY t DESC, id DESC;
                             QUERY PLAN                              
---------------------------------------------------------------------
 Result
   ->  Gather Motion 1:1  (slice1; segments: 1)
         Merge Key: t, id
         ->  Sort
               Sort Key: t DESC, id DESC
               ->  Index Scan using btree_tall_idx on btree_tall_tbl
                     Index Cond: (id = 55)
 Optimizer: Pivotal Optimizer (GPORCA)
(8 rows)

reset enable_seqscan;
reset enable_bitmapscan;
--
-- Test for multilevel page deletion
--
CREATE TABLE delete_test_table (a bigint, b bigint, c bigint, d bigint);
NOTICE:  Table doesn't have 'DISTRIBUTED BY' clause -- Using column named 'a' as the Greenplum Database data distribution key for this table.
HINT:  The 'DISTRIBUTED BY' clause determines the distribution of data. Make sure column(s) chosen are the optimal data distribution key to minimize skew.
INSERT INTO delete_test_table SELECT i, 1, 2, 3 FROM generate_series(1,80000) i;
ALTER TABLE delete_test_table ADD PRIMARY KEY (a,b,c,d);
-- Delete most entries, and vacuum, deleting internal pages and creating "fast
-- root"
DELETE FROM delete_test_table WHERE a < 79990;
VACUUM delete_test_table;
--
-- Test B-tree insertion with a metapage update (XLOG_BTREE_INSERT_META
-- WAL record type). This happens when a "fast root" page is split.  This
-- also creates coverage for nbtree FSM page recycling.
--
-- The vacuum above should've turned the leaf page into a fast root. We just
-- need to insert some rows to cause the fast root page to split.
INSERT INTO delete_test_table SELECT i, 1, 2, 3 FROM generate_series(1,1000) i;
--
-- GPDB: Test correctness of B-tree stats in consecutively VACUUM.
--
CREATE TABLE btree_stats_tbl(col_int int, col_text text, col_numeric numeric, col_unq int) DISTRIBUTED BY (col_int);
CREATE INDEX btree_stats_idx ON btree_stats_tbl(col_int);
INSERT INTO btree_stats_tbl VALUES (1, 'aa', 1001, 101), (2, 'bb', 1002, 102);
SELECT reltuples FROM pg_class WHERE relname='btree_stats_tbl';
 reltuples 
-----------
        -1
(1 row)

-- inspect the state of the stats on segments
SELECT gp_segment_id, relname, reltuples FROM gp_dist_random('pg_class') WHERE relname = 'btree_stats_idx';
 gp_segment_id |     relname     | reltuples 
---------------+-----------------+-----------
             1 | btree_stats_idx |         0
             0 | btree_stats_idx |         0
             2 | btree_stats_idx |         0
(3 rows)

SELECT reltuples FROM pg_class WHERE relname='btree_stats_idx';
 reltuples 
-----------
         0
(1 row)

-- 1st VACUUM, expect reltuples = 2
vacuum btree_stats_tbl;
SELECT reltuples FROM pg_class WHERE relname='btree_stats_tbl';
 reltuples 
-----------
         2
(1 row)

-- inspect the state of the stats on segments
SELECT gp_segment_id, relname, reltuples FROM gp_dist_random('pg_class') WHERE relname = 'btree_stats_idx';
 gp_segment_id |     relname     | reltuples 
---------------+-----------------+-----------
             0 | btree_stats_idx |         0
             1 | btree_stats_idx |         0
             2 | btree_stats_idx |         0
(3 rows)

SELECT reltuples FROM pg_class WHERE relname='btree_stats_idx';
 reltuples 
-----------
         0
(1 row)

-- 2nd VACUUM, expect reltuples = 2
vacuum btree_stats_tbl;
SELECT reltuples FROM pg_class WHERE relname='btree_stats_tbl';
 reltuples 
-----------
         2
(1 row)

-- inspect the state of the stats on segments
SELECT gp_segment_id, relname, reltuples FROM gp_dist_random('pg_class') WHERE relname = 'btree_stats_idx';
 gp_segment_id |     relname     | reltuples 
---------------+-----------------+-----------
             0 | btree_stats_idx |         0
             2 | btree_stats_idx |         0
             1 | btree_stats_idx |         0
(3 rows)

SELECT reltuples FROM pg_class WHERE relname='btree_stats_idx';
 reltuples 
-----------
         0
(1 row)

-- Prior to this fix, the case would be failed here. Given the
-- scenario of updating stats during VACUUM:
-- 1) coordinator vacuums and updates stats of its own;
-- 2) then coordinator dispatches vacuum to segments;
-- 3) coordinator combines stats received from segments to overwrite the stats of its own.
-- Because upstream introduced a feature which could skip full index scan uring cleanup
-- of B-tree indexes when possible (refer to:
-- https://github.com/postgres/postgres/commit/857f9c36cda520030381bd8c2af20adf0ce0e1d4),
-- there was a case in QD-QEs distributed deployment that some QEs could skip full index scan and
-- stop updating statistics, result in QD being unable to collect all QEs' stats thus overwrote
-- a paritial accumulated value to index->reltuples. More interesting, it usually happened starting
-- from the 3rd time of consecutively VACUUM after fresh inserts due to above skipping index scan
-- criteria.
-- 3rd VACUUM, expect reltuples = 2
vacuum btree_stats_tbl;
SELECT reltuples FROM pg_class WHERE relname='btree_stats_tbl';
 reltuples 
-----------
         2
(1 row)

-- inspect the state of the stats on segments
SELECT gp_segment_id, relname, reltuples FROM gp_dist_random('pg_class') WHERE relname = 'btree_stats_idx';
 gp_segment_id |     relname     | reltuples 
---------------+-----------------+-----------
             0 | btree_stats_idx |         0
             1 | btree_stats_idx |         0
             2 | btree_stats_idx |         0
(3 rows)

SELECT reltuples FROM pg_class WHERE relname='btree_stats_idx';
 reltuples 
-----------
         0
(1 row)

-- Test unsupported btree opclass parameters
create index on btree_tall_tbl (id int4_ops(foo=1));
ERROR:  operator class int4_ops has no options
-- test parallel build with immutable function.
CREATE TABLE btree_test_expr (n int);
NOTICE:  Table doesn't have 'DISTRIBUTED BY' clause -- Using column named 'n' as the Greenplum Database data distribution key for this table.
HINT:  The 'DISTRIBUTED BY' clause determines the distribution of data. Make sure column(s) chosen are the optimal data distribution key to minimize skew.
CREATE FUNCTION btree_test_func() RETURNS int LANGUAGE sql IMMUTABLE RETURN 0;
BEGIN;
SET LOCAL min_parallel_table_scan_size = 0;
SET LOCAL max_parallel_maintenance_workers = 4;
CREATE INDEX btree_test_expr_idx ON btree_test_expr USING btree (btree_test_func());
COMMIT;
DROP TABLE btree_test_expr;
DROP FUNCTION btree_test_func();
-- Test case of ALTER INDEX with abuse of column names for indexes.
-- This grammar is not officially supported, but the parser allows it.
CREATE INDEX btree_tall_idx2 ON btree_tall_tbl (id);
ALTER INDEX btree_tall_idx2 ALTER COLUMN id SET (n_distinct=100);
ERROR:  ALTER action ALTER COLUMN ... SET cannot be performed on relation "btree_tall_idx2"
DETAIL:  This operation is not supported for indexes.
DROP INDEX btree_tall_idx2;
-- Partitioned index
CREATE TABLE btree_part (id int4) PARTITION BY RANGE (id);
NOTICE:  Table doesn't have 'DISTRIBUTED BY' clause -- Using column named 'id' as the Greenplum Database data distribution key for this table.
HINT:  The 'DISTRIBUTED BY' clause determines the distribution of data. Make sure column(s) chosen are the optimal data distribution key to minimize skew.
CREATE INDEX btree_part_idx ON btree_part(id);
ALTER INDEX btree_part_idx ALTER COLUMN id SET (n_distinct=100);
ERROR:  ALTER action ALTER COLUMN ... SET cannot be performed on relation "btree_part_idx"
DETAIL:  This operation is not supported for partitioned indexes.
DROP TABLE btree_part;
